{
  "$schema": "https://json-schema.org/draft/2020-12/schema",
  "$id": "https://contracts.consilium.internal/meta/template-registry/1.0",
  "title": "TemplateRegistryMeta",
  "description": "Meta-schema for registry/template-registry.json. Enumerates all published report-type profiles and their required/optional evidence mappings.",
  "type": "object",
  "required": ["description", "generatedAt", "version", "entries"],
  "additionalProperties": false,
  "properties": {
    "$schema": {
      "type": "string",
      "description": "JSON Schema URI — should reference this meta-schema."
    },
    "description": {
      "type": "string",
      "description": "Human-readable description of this registry."
    },
    "generatedAt": {
      "type": "string",
      "format": "date-time",
      "description": "ISO 8601 timestamp when this registry was last generated."
    },
    "version": {
      "type": "string",
      "description": "Package version this registry was generated from.",
      "pattern": "^[0-9]+\\.[0-9]+\\.[0-9]+$"
    },
    "entries": {
      "type": "array",
      "description": "List of published report-type profile entries.",
      "minItems": 1,
      "items": {
        "type": "object",
        "required": ["reportType", "version", "path", "description", "status", "requiredEvidenceTypes"],
        "additionalProperties": false,
        "properties": {
          "reportType": {
            "type": "string",
            "description": "Unique identifier for the report/transaction type.",
            "pattern": "^[A-Za-z0-9_]+$"
          },
          "version": {
            "type": "string",
            "description": "Version of the report-type profile."
          },
          "path": {
            "type": "string",
            "description": "Relative path from the package root to the profile file."
          },
          "description": {
            "type": "string",
            "description": "Short description of the report type."
          },
          "status": {
            "type": "string",
            "enum": ["STABLE", "BETA", "DEPRECATED"],
            "description": "Publication status of this report-type profile."
          },
          "requiredEvidenceTypes": {
            "type": "array",
            "description": "Evidence types that must be present for this report.",
            "items": { "type": "string" },
            "minItems": 1
          },
          "optionalEvidenceTypes": {
            "type": "array",
            "description": "Evidence types that are optional for this report.",
            "items": { "type": "string" }
          }
        }
      }
    }
  }
}
